{
  "$schema": "http://json-schema.org/draft-07/schema#",
  "$id": "https://unisonos.ai/schemas/prompt/priorities.schema.json",
  "title": "Unison Prompt Priorities",
  "type": "object",
  "required": ["schema_version", "verbosity", "risk_tolerance", "current_goals"],
  "additionalProperties": false,
  "properties": {
    "schema_version": {
      "type": "string",
      "pattern": "^1\\.[0-9]+$"
    },
    "verbosity": { "type": "string", "enum": ["concise", "normal", "detailed"] },
    "risk_tolerance": { "type": "string", "enum": ["low", "medium", "high"] },
    "current_goals": {
      "type": "array",
      "items": { "type": "string", "minLength": 1 },
      "minItems": 1
    },
    "focus_areas": {
      "type": "array",
      "items": { "type": "string", "minLength": 1 }
    },
    "do_rules": {
      "type": "array",
      "items": { "type": "string", "minLength": 1 }
    },
    "dont_rules": {
      "type": "array",
      "items": { "type": "string", "minLength": 1 }
    }
  }
}

